{
  "$schema": "../schema/prophets.schema.json",
  "version": 1,
  "lang": "de",
  "dir": "ltr",
  "translation": {
    "status": "machine",
    "from": "ar",
    "reviewedBy": null,
    "reviewedAt": null
  },
  "source": {
    "file": "prophets-content",
    "generatedBy": "tools/build_content.py",
    "generatedAt": "2026-08-15"
  },
  "sources": [
    {
      "id": "quran-com",
      "label": "Quran.com",
      "url": "https://quran.com/"
    }
  ],
  "prophets": [
    {
      "id": "adam",
      "order": 1,
      "name": "Adam, Friede sei mit ihm",
      "shortName": "Adam",
      "people": "Seine Nachkommen; der Koran nennt für ihn kein eigenes Volk",
      "book": {
        "text": "Es wird kein Buch unter seinem Namen genannt",
        "namedInQuran": false,
        "bookId": null
      },
      "sinsAndPunishment": "Er hatte kein leugnendes Volk im üblichen Sinne; überliefert ist die Geschichte von Iblis und der Einflüsterung an Adam und Eva",
      "message": "Die Einheit Gottes, der Gehorsam ihm gegenüber und die Reue bei Fehltritten",
      "placeText": "Das Paradies, dann die Erde; der Koran nennt den Ort seines Herabkommens nicht",
      "locations": [
        "paradise"
      ],
      "locationCertainty": "unspecified",
      "lineage": {
        "branch": "pre-abrahamic"
      }
    },
    {
      "id": "idris",
      "order": 2,
      "name": "Idris, Friede sei mit ihm",
      "shortName": "Idris",
      "people": "Im Koran nicht näher bestimmt",
      "book": {
        "text": "Es wird kein Buch genannt",
        "namedInQuran": false,
        "bookId": null
      },
      "sinsAndPunishment": "Der Koran nennt weder sein Volk noch eine Strafe für ein leugnendes Volk",
      "message": "Wahrhaftigkeit, Aufrichtigkeit und Gottesdienst; Gott spricht: „Er war ein Wahrhaftiger und Prophet“ (Maryam 19:56)",
      "placeText": "Im Koran nicht bestimmt",
      "locations": [],
      "locationCertainty": "unspecified",
      "lineage": {
        "branch": "pre-abrahamic"
      },
      "quranRefs": [
        "19:56"
      ]
    },
    {
      "id": "nuh",
      "order": 3,
      "name": "Nuh (Noah), Friede sei mit ihm",
      "shortName": "Nuh",
      "people": "**Das Volk Nuhs**",
      "book": {
        "text": "Es wird kein Buch unter seinem Namen genannt",
        "namedInQuran": false,
        "bookId": null
      },
      "sinsAndPunishment": "Beigesellung und Götzendienst, Leugnung und Hochmut; **sie ertranken in der Flut**",
      "message": "Die Einheit Gottes, die Abkehr vom Götzendienst, das Bitten um Vergebung und die Warnung vor der Strafe",
      "placeText": "Der Koran bestimmt sein Land nicht genau",
      "locations": [],
      "locationCertainty": "unspecified",
      "sins": [
        "shirk",
        "arrogance"
      ],
      "lineage": {
        "branch": "pre-abrahamic"
      }
    },
    {
      "id": "hud",
      "order": 4,
      "name": "Hud, Friede sei mit ihm",
      "shortName": "Hud",
      "people": "**Ad**",
      "book": {
        "text": "Es wird kein Buch genannt",
        "namedInQuran": false,
        "bookId": null
      },
      "sinsAndPunishment": "Beigesellung, Hochmut, Gewalt und Willkür sowie Leugnung; sie wurden **durch den unfruchtbaren Wind** vernichtet",
      "message": "Die alleinige Anbetung Gottes, die Abkehr vom Hochmut und die Dankbarkeit für die Gaben",
      "placeText": "**Al-Ahqaf**; höchstwahrscheinlich der Süden der Arabischen Halbinsel",
      "locations": [
        "al-ahqaf"
      ],
      "locationCertainty": "traditional",
      "sins": [
        "shirk",
        "arrogance"
      ],
      "lineage": {
        "branch": "other"
      }
    },
    {
      "id": "salih",
      "order": 5,
      "name": "Salih, Friede sei mit ihm",
      "shortName": "Salih",
      "people": "**Thamud**",
      "book": {
        "text": "Es wird kein Buch genannt",
        "namedInQuran": false,
        "bookId": null
      },
      "sinsAndPunishment": "Beigesellung, Leugnung und **das Töten der Kamelstute**; der Schrei und das Beben ergriffen sie, und sie kamen um",
      "message": "Die Einheit Gottes, die Abkehr vom Verderben und die Achtung des Zeichens Gottes, der Kamelstute",
      "placeText": "**Al-Hidschr** im Nordwesten der Arabischen Halbinsel",
      "locations": [
        "al-hijr"
      ],
      "locationCertainty": "traditional",
      "sins": [
        "shirk",
        "arrogance"
      ],
      "lineage": {
        "branch": "other"
      }
    },
    {
      "id": "ibrahim",
      "order": 6,
      "name": "Ibrahim (Abraham), Friede sei mit ihm",
      "shortName": "Ibrahim",
      "people": "Sein Volk, darunter Götzendiener; er rief dann zur Einheit Gottes auf",
      "book": {
        "text": "**Die Blätter Ibrahims**, im Koran erwähnt",
        "namedInQuran": true,
        "bookId": "suhuf-ibrahim"
      },
      "sinsAndPunishment": "Beigesellung und Götzendienst; sein Volk versuchte ihn zu verbrennen, doch Gott rettete ihn",
      "message": "Die Auseinandersetzung mit den Polytheisten, die Widerlegung der Argumente der Beigesellung, die aufrichtige Anbetung Gottes und der Bau des Heiligen Hauses",
      "placeText": "Irak / Mesopotamien, dann asch-Scham und Mekka",
      "locations": [
        "mesopotamia",
        "ash-sham",
        "mecca"
      ],
      "locationCertainty": "traditional",
      "sins": [
        "shirk"
      ],
      "lineage": {
        "branch": "other"
      }
    },
    {
      "id": "lut",
      "order": 7,
      "name": "Lut (Lot), Friede sei mit ihm",
      "shortName": "Lut",
      "people": "**Das Volk Luts**",
      "book": {
        "text": "Es wird kein Buch genannt",
        "namedInQuran": false,
        "bookId": null
      },
      "sinsAndPunishment": "Unzucht, Wegelagerei, offenes Zurschaustellen des Verwerflichen und Leugnung; **ihre Städte wurden umgekehrt und mit Steinen überschüttet**",
      "message": "Die Einheit Gottes, Reinheit und die Abkehr von Unzucht",
      "placeText": "Die Städte des Volkes Luts, nach der bekanntesten Ansicht in der Region des Toten Meeres",
      "locations": [
        "cities-of-lut"
      ],
      "locationCertainty": "traditional",
      "sins": [
        "shirk",
        "moral-corruption"
      ],
      "lineage": {
        "branch": "other",
        "contemporaryOf": [
          "ibrahim"
        ]
      }
    },
    {
      "id": "ismail",
      "order": 8,
      "name": "Isma'il (Ismael), Friede sei mit ihm",
      "shortName": "Isma'il",
      "people": "Seine Nachkommen, die Bewohner Mekkas und deren Umgebung",
      "book": {
        "text": "Es wird kein Buch genannt",
        "namedInQuran": false,
        "bookId": null
      },
      "sinsAndPunishment": "Der Koran nennt kein Volk, das ihn leugnete, und keine kollektive Strafe",
      "message": "Gebet und Almosen, Wahrhaftigkeit und Vertragstreue: „er war wahrhaftig in seinem Versprechen“ (Maryam 19:54)",
      "placeText": "**Mekka**",
      "locations": [
        "mecca"
      ],
      "locationCertainty": "quranic",
      "lineage": {
        "branch": "ismaili",
        "parentId": "ibrahim"
      },
      "quranRefs": [
        "19:54"
      ]
    },
    {
      "id": "ishaq",
      "order": 9,
      "name": "Ishaq (Isaak), Friede sei mit ihm",
      "shortName": "Ishaq",
      "people": "Seine Nachkommen",
      "book": {
        "text": "Es wird kein Buch genannt",
        "namedInQuran": false,
        "bookId": null
      },
      "sinsAndPunishment": "Der Koran nennt kein eigenes Volk, das ihn leugnete",
      "message": "Die Fortsetzung der Verkündigung Ibrahims und der Einheit Gottes",
      "placeText": "Großsyrien (asch-Scham)",
      "locations": [
        "ash-sham"
      ],
      "locationCertainty": "traditional",
      "lineage": {
        "branch": "israelite",
        "parentId": "ibrahim"
      }
    },
    {
      "id": "yaqub",
      "order": 10,
      "name": "Ya'qub (Jakob, Israel), Friede sei mit ihm",
      "shortName": "Ya'qub",
      "people": "Seine Nachkommen, **die Kinder Israels**",
      "book": {
        "text": "Es wird kein Buch genannt",
        "namedInQuran": false,
        "bookId": null
      },
      "sinsAndPunishment": "Der Koran nennt keine Strafe für sein Volk zu seiner Zeit",
      "message": "Einheit Gottes, Gottesdienst und sein Vermächtnis an seine Söhne, an der Religion Gottes festzuhalten",
      "placeText": "Großsyrien (asch-Scham)",
      "locations": [
        "ash-sham"
      ],
      "locationCertainty": "traditional",
      "lineage": {
        "branch": "israelite",
        "parentId": "ishaq"
      }
    },
    {
      "id": "yusuf",
      "order": 11,
      "name": "Yusuf (Josef), Friede sei mit ihm",
      "shortName": "Yusuf",
      "people": "Die Bewohner Ägyptens und seine Angehörigen von den Kindern Israels",
      "book": {
        "text": "Es wird kein Buch genannt",
        "namedInQuran": false,
        "bookId": null
      },
      "sinsAndPunishment": "Der Koran nennt kein Volk, das wegen seiner Leugnung bestraft wurde",
      "message": "Einheit Gottes, Keuschheit, Vertrauenswürdigkeit, Geduld, Vergebung und die Verwaltung der Staatsgeschäfte",
      "placeText": "**Ägypten**",
      "locations": [
        "egypt"
      ],
      "locationCertainty": "quranic",
      "lineage": {
        "branch": "israelite",
        "parentId": "yaqub"
      }
    },
    {
      "id": "ayyub",
      "order": 12,
      "name": "Ayyub (Hiob), Friede sei mit ihm",
      "shortName": "Ayyub",
      "people": "Sein Volk ist nicht näher bestimmt",
      "book": {
        "text": "Es wird kein Buch genannt",
        "namedInQuran": false,
        "bookId": null
      },
      "sinsAndPunishment": "Der Koran nennt keine Strafe für sein Volk",
      "message": "Geduld in der Prüfung, Zuflucht bei Gott und kein Verzweifeln",
      "placeText": "Im Koran nicht bestimmt; traditionell der Region asch-Scham zugeschrieben",
      "locations": [